University,Module Code,Module Level,Module Title,mod_dept,mod_desc,mod_proj,mod_exam,mod_prereq,mod_preclu,mod_link,mod_category,All Module Details
NUS,DSA4263,4,Sense-making Case Analysis: Business and Commerce,DSA,"The practice of data science involves sense-making, the ability to formulate problems or hypotheses in real-world situations. Only when algorithms and technology are applied to meaningful problems or hypotheses can useful information be extracted from data for making decisions. This module is conducted as a series of hackathons data scientists from partnering organisations in the business and commerce sector provide the real-world situations and data which will enable students to gain practical experience in (i) formulating problems, (ii) solving them by applying, or developing and implementing, appropriate data-analytic tools and techniques, and (iii) communicating findings and insights gained clearly.",1,0,"CS3244, DSA3101",DSA4263A/DSA4263B,https://nusmods.com/modules/DSA4263/sense-making-case-analysis-business-and-commerce,"Data Science, Data Analytics","The practice of data science involves sense-making, the ability to formulate problems or hypotheses in real-world situations. Only when algorithms and technology are applied to meaningful problems or hypotheses can useful information be extracted from data for making decisions. This module is conducted as a series of hackathons data scientists from partnering organisations in the business and commerce sector provide the real-world situations and data which will enable students to gain practical experience in (i) formulating problems, (ii) solving them by applying, or developing and implementing, appropriate data-analytic tools and techniques, and (iii) communicating findings and insights gained clearly."
NUS,DSA4266,4,Sense-making Case Analysis: Science and Technology,DSA,"The practice of data science involves sense-making, the ability to formulate problems or hypotheses in real-world situations. Only when algorithms and technology are applied to meaningful problems or hypotheses can useful information be extracted from data for making decisions. This module is conducted as a series of hackathons: data scientists from partnering organisations in the science and technology sector provide the real-world situations and data which will enable students to gain practical experience in (i) formulating problems, (ii) solving them by applying, or developing and implementing, appropriate data-analytic tools and techniques, and (iii) communicating findings and insights gained clearly.",1,0,"CS3244, DSA3101",DSA4266A/DSA4266B,https://nusmods.com/modules/DSA4266/sense-making-case-analysis-science-and-technology,"Data Science, Data Analytics","The practice of data science involves sense-making, the ability to formulate problems or hypotheses in real-world situations. Only when algorithms and technology are applied to meaningful problems or hypotheses can useful information be extracted from data for making decisions. This module is conducted as a series of hackathons: data scientists from partnering organisations in the science and technology sector provide the real-world situations and data which will enable students to gain practical experience in (i) formulating problems, (ii) solving them by applying, or developing and implementing, appropriate data-analytic tools and techniques, and (iii) communicating findings and insights gained clearly."
NUS,MA3236,3,Non-Linear Programming,MA,"Optimization principles are of undisputed importance in modern design and system operation. The objective of this course is to present these principles and illustrate how algorithms can be designed from the mathematical theories for solving optimization problems. Major topics: Fundamentals, unconstrained optimization: one-dimensional search, Newton-Raphson method, gradient method, constrained optimization: Lagrangian multipliers method, Karush-Kuhn-Tucker optimality conditions, Lagrangian duality and saddle point optimality conditions, convex programming: Frank-Wolfe method.",0,1,MA2311,DSA3102/DSC3214/DSN3701,https://nusmods.com/modules/MA3236/non-linear-programming,Mathematics,"Optimization principles are of undisputed importance in modern design and system operation. The objective of this course is to present these principles and illustrate how algorithms can be designed from the mathematical theories for solving optimization problems. Major topics: Fundamentals, unconstrained optimization: one-dimensional search, Newton-Raphson method, gradient method, constrained optimization: Lagrangian multipliers method, Karush-Kuhn-Tucker optimality conditions, Lagrangian duality and saddle point optimality conditions, convex programming: Frank-Wolfe method."
NUS,MA3252,3,Linear and Network Optimisation,MA,"The objective of this course is to work on optimization problems which can be formulated as linear and network optimization problems. We formulate linear programming (LP) problems and solve them by the simplex method (algorithm). We also look at the geometrical aspect and develop the mathematical theory of the simplex method. We further study problems which may be formulated using graphs and networks. These optimization problems can be solved by using linear or integer programming approaches. However, due to its graphical structure, it is easier to handle these problems by using network algorithmic approaches. Applications of LP and network optimization will be demonstrated. This course should help the student in developing confidence in solving many similar problems in daily life that require much computing. Major topics: Introduction to LP: solving 2-variable LP via graphical methods. Geometry of LP: polyhedron, extreme points, existence of optimal solution at extreme point. Development of simplex method: basic solution, reduced costs and optimality condition, iterative steps in a simplex method, 2-phase method and Big-M method. Duality: dual LP, duality theory, dual simplex method. Sensitivity Analysis. Network optimization problems: minimal spanning tree problems, shortest path problems, maximal flow problems, minimum cost flow problems, salesman problems and postman problems.",0,1,MA1101R,"BH3214/CS3252/DSN3701/IC2231/MA3235""/MQ2204/DSC3214",https://nusmods.com/modules/MA3252/linear-and-network-optimisation,Mathematics,"The objective of this course is to work on optimization problems which can be formulated as linear and network optimization problems. We formulate linear programming (LP) problems and solve them by the simplex method (algorithm). We also look at the geometrical aspect and develop the mathematical theory of the simplex method. We further study problems which may be formulated using graphs and networks. These optimization problems can be solved by using linear or integer programming approaches. However, due to its graphical structure, it is easier to handle these problems by using network algorithmic approaches. Applications of LP and network optimization will be demonstrated. This course should help the student in developing confidence in solving many similar problems in daily life that require much computing. Major topics: Introduction to LP: solving 2-variable LP via graphical methods. Geometry of LP: polyhedron, extreme points, existence of optimal solution at extreme point. Development of simplex method: basic solution, reduced costs and optimality condition, iterative steps in a simplex method, 2-phase method and Big-M method. Duality: dual LP, duality theory, dual simplex method. Sensitivity Analysis. Network optimization problems: minimal spanning tree problems, shortest path problems, maximal flow problems, minimum cost flow problems, salesman problems and postman problems."
NUS,MA4270,4,Data Modelling and Computation,MA,"This course aims at presenting important mathematical concepts and computational methods that are often used for modelling and analysis of big data sets and complex networks. The emphasis is on mathematical modelling and computational methods for practical problems in data science. Major topics include: basics on convex analysis, numerical methods for large-scale convex problems, dimensionality reduction, numerical methods for machine learning, kernel methods for pattern analysis, sparse coding and dictionary learning.",1,1,"DSA2102, ST2131",CS5339/DSA5102,https://nusmods.com/modules/MA4270/data-modelling-and-computation,Mathematics,"This course aims at presenting important mathematical concepts and computational methods that are often used for modelling and analysis of big data sets and complex networks. The emphasis is on mathematical modelling and computational methods for practical problems in data science. Major topics include: basics on convex analysis, numerical methods for large-scale convex problems, dimensionality reduction, numerical methods for machine learning, kernel methods for pattern analysis, sparse coding and dictionary learning."
NUS,ST3232,3,Design & Analysis of Experiments,ST,"This module covers common designs of experiments and their analysis. Topics include basic experimental designs, analysis of one-way and two way layout data, multiple comparisons, factorial designs, 2k-factorial designs, blocking and confounding, fractional factorial design and nested designs. This module is targeted at students who are interested in Statistics and are able to meet the pre-requisites.",1,1,ST2132,,https://nusmods.com/modules/ST3232/design-analysis-of-experiments,Statistics,"This module covers common designs of experiments and their analysis. Topics include basic experimental designs, analysis of one-way and two way layout data, multiple comparisons, factorial designs, 2k-factorial designs, blocking and confounding, fractional factorial design and nested designs. This module is targeted at students who are interested in Statistics and are able to meet the pre-requisites."
NUS,ST4253,4,Applied Time Series Analysis,ST,"This module introduces the modelling and analysis of time series data. A computer package will be used to analyse real data sets. Topics include stationary time series, ARIMA models, estimation and forecasting with ARIMA models This module is targeted at students who are interested in Statistics and are able to meet the pre-requisites.",1,1,ST2132,ST3233,https://nusmods.com/modules/ST4253/applied-time-series-analysis,Statistics,"This module introduces the modelling and analysis of time series data. A computer package will be used to analyse real data sets. Topics include stationary time series, ARIMA models, estimation and forecasting with ARIMA models This module is targeted at students who are interested in Statistics and are able to meet the pre-requisites."
NUS,ST3239,3,Survey Methodology,ST,"This module gives an introduction to the design of sample surveys and estimation procedures, with emphasis on practical applications in survey sampling. Topics include planning of surveys, questionnaire construction, methods of data collection, fieldwork procedures, sources of errors, basic ideas of sampling, simple random sampling, stratified, systematic, replicated, cluster and quota sampling, sample size determination and cost. This module is targeted at students who are interested in Statistics and are able to meet the pre-requisites.",1,1,ST2131,,https://nusmods.com/modules/ST3239/survey-methodology,Statistics,"This module gives an introduction to the design of sample surveys and estimation procedures, with emphasis on practical applications in survey sampling. Topics include planning of surveys, questionnaire construction, methods of data collection, fieldwork procedures, sources of errors, basic ideas of sampling, simple random sampling, stratified, systematic, replicated, cluster and quota sampling, sample size determination and cost. This module is targeted at students who are interested in Statistics and are able to meet the pre-requisites."
NUS,ST4250,4,Multivariate Statistical Analysis,ST,"This module focuses on the classical theory and methods of multivariate statistical analysis. Topics include distribution theory multivariate normal distribution, Hotelling's T2 and Wishart distributions, inference on the mean and covariance, principal components and canonical correlation, factor analysis, discrimination and classification. This module is targeted at students who are interested in Statistics, are able to meet the pre-requisites and are matriculated in or after 2002.",1,1,ST3131,ST3240,https://nusmods.com/modules/ST4250/multivariate-statistical-analysis,Statistics,"This module focuses on the classical theory and methods of multivariate statistical analysis. Topics include distribution theory multivariate normal distribution, Hotelling's T2 and Wishart distributions, inference on the mean and covariance, principal components and canonical correlation, factor analysis, discrimination and classification. This module is targeted at students who are interested in Statistics, are able to meet the pre-requisites and are matriculated in or after 2002."
NUS,ST3247,3,Simulation,ST,"The advent of fast and inexpensive computational power has facilitated the description of real phenomenon using realistic stochastic models which can be analysed using simulation studies. This module teaches students how to analyse a model by use of a simulation study and the topics include pseudorandom number generation, generating discrete and continuous random variables, simulating discrete events, statistical analysis of simulated data, variance reduction, Markov Chain Monte Carlo methods. It also covers topics in stochastic optimisation such as simulated annealing. This module is targeted at students who are interested in Statistics and are able to meet the prerequisites.",1,1,"ST2131, CS1010",,https://nusmods.com/modules/ST3247/simulation,Statistics,"The advent of fast and inexpensive computational power has facilitated the description of real phenomenon using realistic stochastic models which can be analysed using simulation studies. This module teaches students how to analyse a model by use of a simulation study and the topics include pseudorandom number generation, generating discrete and continuous random variables, simulating discrete events, statistical analysis of simulated data, variance reduction, Markov Chain Monte Carlo methods. It also covers topics in stochastic optimisation such as simulated annealing. This module is targeted at students who are interested in Statistics and are able to meet the prerequisites."
NUS,ST3248,3,Statistical Learning I,ST,"Statistical learning is a large collection of computer-based modelling and prediction tools with applications in diverse fields including business, medicine, astrophysics, and public policy. This series of two modules covers many of the popular approaches for a variety of statistical problems. There is heavy emphasis on the implementation of these methods on real-world data sets in the popular statistical software package R. Part I gives a broad overview of the common problems as well as their most popular approaches. Topics include linear regression model and its extensions, classification methods, resampling methods, regularisation and model selection, principal components and clustering methods.",1,1, ST2132,ST4240/YSC4216,https://nusmods.com/modules/ST3248/statistical-learning-i,Statistics,"Statistical learning is a large collection of computer-based modelling and prediction tools with applications in diverse fields including business, medicine, astrophysics, and public policy. This series of two modules covers many of the popular approaches for a variety of statistical problems. There is heavy emphasis on the implementation of these methods on real-world data sets in the popular statistical software package R. Part I gives a broad overview of the common problems as well as their most popular approaches. Topics include linear regression model and its extensions, classification methods, resampling methods, regularisation and model selection, principal components and clustering methods."
NUS,ST4231,4,Computer Intensive Statistical Methods,ST,"The availability of high-speed computation has led to the development of “modern” statistical methods which are implemented in the form of well-understood computer algorithms. This module introduces students to several computer intensive statistical methods and the topics include empirical distribution and plug-in principle, general algorithm of bootstrap method, bootstrap estimates of standard deviation and bias, jack-knife method, bootstrap confidence intervals, the empirical likelihood for the mean and parameters defined by simple estimating function, Wilks theorem, and EL confidence intervals, missing data, EM algorithm, Markov Chain Monte Carlo methods. This module is targeted at students who are interested in Statistics and are able to meet the prerequisite.",1,1,ST2132,,https://nusmods.com/modules/ST4231/computer-intensive-statistical-methods,Statistics,"The availability of high-speed computation has led to the development of “modern” statistical methods which are implemented in the form of well-understood computer algorithms. This module introduces students to several computer intensive statistical methods and the topics include empirical distribution and plug-in principle, general algorithm of bootstrap method, bootstrap estimates of standard deviation and bias, jack-knife method, bootstrap confidence intervals, the empirical likelihood for the mean and parameters defined by simple estimating function, Wilks theorem, and EL confidence intervals, missing data, EM algorithm, Markov Chain Monte Carlo methods. This module is targeted at students who are interested in Statistics and are able to meet the prerequisite."
NUS,ST4234,4,Bayesian Statistics,ST,"Bayesian principles: Bayes' theorem, estimation, hypothesis testing, prior distributions, likelihood, predictive distributions. Bayesian computation: numerical approximation, posterior simulation and integration, Markov chain simulation, models and applications: hierarchical linear models, generalized linear models, multivariate models, mixture models, models for missing data, case studies. This module is targeted at students who are interested in Statistics and are able to meet the pre-requisites.",1,1,ST2132,,https://nusmods.com/modules/ST4234/bayesian-statistics,Statistics,"Bayesian principles: Bayes' theorem, estimation, hypothesis testing, prior distributions, likelihood, predictive distributions. Bayesian computation: numerical approximation, posterior simulation and integration, Markov chain simulation, models and applications: hierarchical linear models, generalized linear models, multivariate models, mixture models, models for missing data, case studies. This module is targeted at students who are interested in Statistics and are able to meet the pre-requisites."
NUS,ST4248,4,Statistical Learning II,ST,"Statistical Learning is a large collection of computer-based modelling and prediction tools with applications in diverse fields including business, medicine, astrophysics, and public policy. This series of two modules covers many of the popular approaches for a variety of statistical problems. There is heavy emphasis on the implementation of these methods on real-world data sets in the popular statistical software package R. Part II builds on the knowledge in Part I, introducing more tools as well as generalising and extending some of the tools covered in Part I using entirely different approaches. Topics include non-parametric smoothing methods, tree-based methods, support vector machines, neural networks and ensemble learning.",1,1," ST3131, ST3248",ST4240/YSC4216,https://nusmods.com/modules/ST4248/statistical-learning-ii,Statistics,"Statistical Learning is a large collection of computer-based modelling and prediction tools with applications in diverse fields including business, medicine, astrophysics, and public policy. This series of two modules covers many of the popular approaches for a variety of statistical problems. There is heavy emphasis on the implementation of these methods on real-world data sets in the popular statistical software package R. Part II builds on the knowledge in Part I, introducing more tools as well as generalising and extending some of the tools covered in Part I using entirely different approaches. Topics include non-parametric smoothing methods, tree-based methods, support vector machines, neural networks and ensemble learning."
NUS,CS3210,3,Parallel Computing,CS,"The aim of this module is to provide an introduction to the field of parallel computing with hands-on parallel programming experience on real parallel machines. The module is divided into four parts parallel computation models and parallelism, parallel architectures, parallel algorithm design and programming, and new parallel computing models. Topics includes theory of parallelism and models; shared-memory architectures; distributed-memory architectures; data parallel architectures; interconnection networks, topologies and basic of communication operations; principles of parallel algorithm design; performance and scalability of parallel programs, overview of new parallel computing models such as grid, cloud, GPGPU.",1,1,CS2100,,https://nusmods.com/modules/CS3210/parallel-computing,Computer Science,"The aim of this module is to provide an introduction to the field of parallel computing with hands-on parallel programming experience on real parallel machines. The module is divided into four parts parallel computation models and parallelism, parallel architectures, parallel algorithm design and programming, and new parallel computing models. Topics includes theory of parallelism and models; shared-memory architectures; distributed-memory architectures; data parallel architectures; interconnection networks, topologies and basic of communication operations; principles of parallel algorithm design; performance and scalability of parallel programs, overview of new parallel computing models such as grid, cloud, GPGPU."
NUS,CS3223,3,Database Systems Implementation,CS,"This system-oriented module provides an in-depth study of the concepts and implementation issues related to database management systems. It first covers the physical implementation of the relational data model, which includes storage management, access methods, query processing, and optimisation. Then it covers issues and techniques dealing with multi-user application environments, namely, transactions, concurrency control, and recovery. The third part covers advanced topics such as on-line analytical processing, in-memory databases, and column stores.",1,1,"CS2040, CS2102",,https://nusmods.com/modules/CS3223/database-systems-implementation,Computer Science,"This system-oriented module provides an in-depth study of the concepts and implementation issues related to database management systems. It first covers the physical implementation of the relational data model, which includes storage management, access methods, query processing, and optimisation. Then it covers issues and techniques dealing with multi-user application environments, namely, transactions, concurrency control, and recovery. The third part covers advanced topics such as on-line analytical processing, in-memory databases, and column stores."
NUS,CS3230,3,Design and Analysis of Algorithms,CS,"This module introduces different techniques of designing and analysing algorithms. Students will learn about the framework for algorithm analysis, for example, lower bound arguments, average case analysis, and the theory of NP-completeness. In addition, students are exposed to various algorithm design paradigms. The module serves two purposes: to improve the students' ability to design algorithms in different areas, and to prepare students for the study of more advanced algorithms. The module covers lower and upper bounds, recurrences, basic algorithm paradigms (such as prune-and-search, dynamic programming, branch-and-bound, graph traversal, and randomised approaches), amortized analysis, NP-completeness, and some selected advanced topics.",1,1,"CS2040, CS1231",,https://nusmods.com/modules/CS3230/design-and-analysis-of-algorithms,Computer Science,"This module introduces different techniques of designing and analysing algorithms. Students will learn about the framework for algorithm analysis, for example, lower bound arguments, average case analysis, and the theory of NP-completeness. In addition, students are exposed to various algorithm design paradigms. The module serves two purposes: to improve the students' ability to design algorithms in different areas, and to prepare students for the study of more advanced algorithms. The module covers lower and upper bounds, recurrences, basic algorithm paradigms (such as prune-and-search, dynamic programming, branch-and-bound, graph traversal, and randomised approaches), amortized analysis, NP-completeness, and some selected advanced topics."
