University,Module Code,Module Level,Module Title,mod_dept,mod_desc,mod_proj,mod_exam,mod_prereq,mod_preclu,mod_link,mod_category,All Module Details
NUS,CS3243,3,Introduction to Artificial Intelligence,CS,"The module introduces the basic concepts in search and knowledge representation as well as to a number of sub-areas of artificial intelligence. It focuses on covering the essential concepts in AI. The module covers Turing test, blind search, iterative deepening, production systems, heuristic search, A* algorithm, minimax and alpha-beta procedures, predicate and first-order logic, resolution refutation, non-monotonic reasoning, assumption-based truth maintenance systems, inheritance hierarchies, the frame problem, certainly factors, Bayes' rule, frames and semantic nets, planning, learning, natural language, vision, and expert systems and LISP.",1,1,"CS2040, CS1231", CS2109S/CS3263,https://nusmods.com/modules/CS3243/introduction-to-artificial-intelligence,Data Science,"The module introduces the basic concepts in search and knowledge representation as well as to a number of sub-areas of artificial intelligence. It focuses on covering the essential concepts in AI. The module covers Turing test, blind search, iterative deepening, production systems, heuristic search, A* algorithm, minimax and alpha-beta procedures, predicate and first-order logic, resolution refutation, non-monotonic reasoning, assumption-based truth maintenance systems, inheritance hierarchies, the frame problem, certainly factors, Bayes' rule, frames and semantic nets, planning, learning, natural language, vision, and expert systems and LISP."
NUS,CS4224,4,Distributed Databases,CS,"This module studies the management of data in a distributed environment. It covers the fundamental principles of distributed data management and includes distribution design, data integration, distributed query processing and optimization, distributed transaction management, and replication. It will also look at how these techniques can be adapted to support database management in emerging technologies (e.g., parallel systems, peer-to-peer systems, cloud computing).",1,1,CS3223, CS5424,https://nusmods.com/modules/CS4224/distributed-databases,Computer Science,"This module studies the management of data in a distributed environment. It covers the fundamental principles of distributed data management and includes distribution design, data integration, distributed query processing and optimization, distributed transaction management, and replication. It will also look at how these techniques can be adapted to support database management in emerging technologies (e.g., parallel systems, peer-to-peer systems, cloud computing)."
NUS,CS4225,4,Big Data Systems for Data Science,CS,"Data science incorporates varying elements and builds on techniques and theories from many fields, including statistics, data engineering, data mining, visualization, data warehousing, and high-performance computing systems with the goal of extracting meaning from big data and creating data products. Data science utilizes advanced computing systems such as Apache Hadoop and Spark to address big data challenges. In this module, students will learn various computing systems and optimization techniques that are used in data science with emphasis on the system building and algorithmic optimizations of these techniques.",1,1, CS2102, BT4221/CS5425,https://nusmods.com/modules/CS4225/big-data-systems-for-data-science,Data Science,"Data science incorporates varying elements and builds on techniques and theories from many fields, including statistics, data engineering, data mining, visualization, data warehousing, and high-performance computing systems with the goal of extracting meaning from big data and creating data products. Data science utilizes advanced computing systems such as Apache Hadoop and Spark to address big data challenges. In this module, students will learn various computing systems and optimization techniques that are used in data science with emphasis on the system building and algorithmic optimizations of these techniques."
NUS,CS4231,4,Parallel and Distributed Algorithms,CS,"This course will examine some fundamental issues in parallel programming and distributed computing, and the relationships between the two. Parallel programming: mutual exclusion, semaphores, consistency, wait-free synchronization. Distributed computing: time, global state, snapshots, message ordering. Relationships: consensus, fault-tolerance, transactions, self-stabilization.",1,1," CS3210, CS3230",,https://nusmods.com/modules/CS4231/parallel-and-distributed-algorithms,Computer Science,"This course will examine some fundamental issues in parallel programming and distributed computing, and the relationships between the two. Parallel programming: mutual exclusion, semaphores, consistency, wait-free synchronization. Distributed computing: time, global state, snapshots, message ordering. Relationships: consensus, fault-tolerance, transactions, self-stabilization."
NUS,CS4234,4,Optimisation Algorithms,CS,"This module covers common algorithmic techniques for solving optimisation problems, and introduces students to approaches for finding good-enough solutions to NP-hard problems. Topics covered include linear and integer programming, network flow algorithms, local search heuristics, approximation algorithms, and randomized algorithms. Through analysis and application of the techniques to a variety of canonical problems, students develop confidence to (i) appropriately model a given optimisation problem, (ii) apply appropriate algorithmic techniques to solve the problem, (iii) analyse the properties of the problem and candidate algorithms, such as time and space complexity, convergence, approximability, and optimality bound.",1,1,"MA1101R,  CS3230",,https://nusmods.com/modules/CS4234/optimisation-algorithms,Computer Science,"This module covers common algorithmic techniques for solving optimisation problems, and introduces students to approaches for finding good-enough solutions to NP-hard problems. Topics covered include linear and integer programming, network flow algorithms, local search heuristics, approximation algorithms, and randomized algorithms. Through analysis and application of the techniques to a variety of canonical problems, students develop confidence to (i) appropriately model a given optimisation problem, (ii) apply appropriate algorithmic techniques to solve the problem, (iii) analyse the properties of the problem and candidate algorithms, such as time and space complexity, convergence, approximability, and optimality bound."
NUS,CS4243,4,Computer Vision and Pattern Recognition,CS,"This module is for undergraduates who are interested in computer vision and its applications. It covers (a) the basic skills needed in handling images and videos, (b) the basic theories needed to understand geometrical computer vision, and (c) pattern recognition. Topics covered in image handling include contrast stretch, histogram equalization, noise removal, and color space. Topics covered in geometrical vision include affine transform, vanishing points, camera projection models, homography, camera calibration, rotation representations including quaternions, epipolar geometry, binocular stereo, structure from motion. Topics covered for pattern recognition include principal component analysis.",1,1,"MA1101R, ST2131, CS2030, MA1102R, CS2040",EE4212/EE4704,https://nusmods.com/modules/CS4243/computer-vision-and-pattern-recognition,Data Science,"This module is for undergraduates who are interested in computer vision and its applications. It covers (a) the basic skills needed in handling images and videos, (b) the basic theories needed to understand geometrical computer vision, and (c) pattern recognition. Topics covered in image handling include contrast stretch, histogram equalization, noise removal, and color space. Topics covered in geometrical vision include affine transform, vanishing points, camera projection models, homography, camera calibration, rotation representations including quaternions, epipolar geometry, binocular stereo, structure from motion. Topics covered for pattern recognition include principal component analysis."
NUS,CS4248,4,Natural Language Processing,CS,"This module deals with computer processing of human languages, including the use of neural networks and deep learning in natural language processing. The topics covered include: regular expressions, words and edit distance, n-grams, part-of-speech tagging, feed-forward neural networks, neural network training, word embedding, convolutional neural networks, recurrent neural networks, sequence-to-sequence models with attention, transformers, context-free grammars, syntactic parsing, semantics, and discourse.",1,1,"CS3243, ST2131, MA1102R",,https://nusmods.com/modules/CS4248/natural-language-processing,Data Science,"This module deals with computer processing of human languages, including the use of neural networks and deep learning in natural language processing. The topics covered include: regular expressions, words and edit distance, n-grams, part-of-speech tagging, feed-forward neural networks, neural network training, word embedding, convolutional neural networks, recurrent neural networks, sequence-to-sequence models with attention, transformers, context-free grammars, syntactic parsing, semantics, and discourse."
NUS,CS5340 ,5,Uncertainty Modelling in AI,CS,"The module covers modelling methods that are suitable for reasoning with uncertainty. The main focus will be on probabilistic models including Bayesian networks and Markov networks. Topics include representing conditional independence, building graphical models, inference using graphical models and learning from data. Selected applications in various domains such as speech, vision, natural language processing, medical informatics, bioinformatics, data mining and others will be discussed.",1,1,"CS3243, ST2132, ST2131",,https://nusmods.com/modules/CS5340/uncertainty-modelling-in-ai,Data Science,"The module covers modelling methods that are suitable for reasoning with uncertainty. The main focus will be on probabilistic models including Bayesian networks and Markov networks. Topics include representing conditional independence, building graphical models, inference using graphical models and learning from data. Selected applications in various domains such as speech, vision, natural language processing, medical informatics, bioinformatics, data mining and others will be discussed."
NUS,MA4230,4,Matrix Computation,MA,"This course provides essential ideas and techniques as well as algorithms in numerical linear algebra that are needed in scientific computing and data analytics for effectively working with vectors and matrices. The major difficulties faced in solving problems in linear algebra numerically are discussed, as well as the associated applications often seen in practice. The emphasis is on the development of elegant and powerful algorithms and their applications for solving practical problems. Major topics include basic vector and matrix manipulation, the singular value decomposition, QR factorization, least squares problems, conditioning and stability, eigenvalue problems, and various applications in scientific computing and data science.",1,1,"MA2101, DSA2102",,https://nusmods.com/modules/MA4230/matrix-computation,Mathematics,"This course provides essential ideas and techniques as well as algorithms in numerical linear algebra that are needed in scientific computing and data analytics for effectively working with vectors and matrices. The major difficulties faced in solving problems in linear algebra numerically are discussed, as well as the associated applications often seen in practice. The emphasis is on the development of elegant and powerful algorithms and their applications for solving practical problems. Major topics include basic vector and matrix manipulation, the singular value decomposition, QR factorization, least squares problems, conditioning and stability, eigenvalue problems, and various applications in scientific computing and data science."
